{"attempt_id":"RC2-DRY-RUN-01","events":[{"code":"DRY_WORKSPACE","event":"workspace_created","sequence":1,"value":null},{"code":"RC1_SEED_VALID","event":"seed_validated","sequence":2,"value":"SEED-INVENTORY-FACT-01"},{"code":"DRY_INVOCATION","event":"invocation_constructed","sequence":3,"value":"cc63683c2845feedb54bb24866a0c04d6fc1dbf64085e1824689958fe12f8c71"},{"code":"DRY_FIXTURE","event":"fixture_captured","sequence":4,"value":309},{"code":"DRY_NORMALIZED","event":"normalization_completed","sequence":5,"value":null}],"schema_version":"1.0","trace_id":"TRACE-RC2-DRY-RUN-01"}
